user,bot
explain data abstraction.,"Data abstraction is a technique used in computer programming to separate the implementation details of a data type from its interface, allowing the implementation to be changed without affecting the code that uses it. This is often achieved through the use of abstract data types (ADTs), which are defined by the operations they support rather than their specific implementation, or through the use of interfaces and classes in object-oriented programming languages. Data abstraction helps to reduce the complexity of software systems by allowing code to be written in a modular and flexible way and by hiding the underlying details of data types from the user."
what is data abstraction?,"Data abstraction is a technique used in computer programming to separate the implementation details of a data type from its interface, allowing the implementation to be changed without affecting the code that uses it. This is often achieved through the use of abstract data types (ADTs), which are defined by the operations they support rather than their specific implementation, or through the use of interfaces and classes in object-oriented programming languages. Data abstraction helps to reduce the complexity of software systems by allowing code to be written in a modular and flexible way and by hiding the underlying details of data types from the user."
define data abstraction.,"Data abstraction is a technique used in computer programming to separate the implementation details of a data type from its interface, allowing the implementation to be changed without affecting the code that uses it. This is often achieved through the use of abstract data types (ADTs), which are defined by the operations they support rather than their specific implementation, or through the use of interfaces and classes in object-oriented programming languages. Data abstraction helps to reduce the complexity of software systems by allowing code to be written in a modular and flexible way and by hiding the underlying details of data types from the user."
what is a syntax error,"A syntax error is an error in the structure of a programming language's code. It occurs when the code does not conform to the rules of the programming language's syntax. Syntax errors can occur for a variety of reasons, such as using the wrong punctuation, omitting required elements, or using an incorrect keyword. Syntax errors are usually detected by a compiler or interpreter when the code is being compiled or executed, and they can prevent the code from running correctly. To fix a syntax error, the code must be revised to conform to the correct syntax of the programming language."
explain syntax error,"A syntax error is an error in the structure of a programming language's code. It occurs when the code does not conform to the rules of the programming language's syntax. Syntax errors can occur for a variety of reasons, such as using the wrong punctuation, omitting required elements, or using an incorrect keyword. Syntax errors are usually detected by a compiler or interpreter when the code is being compiled or executed, and they can prevent the code from running correctly. To fix a syntax error, the code must be revised to conform to the correct syntax of the programming language."
why syntax error occurs?,"A syntax error is an error in the structure of a programming language's code. It occurs when the code does not conform to the rules of the programming language's syntax. Syntax errors can occur for a variety of reasons, such as using the wrong punctuation, omitting required elements, or using an incorrect keyword. Syntax errors are usually detected by a compiler or interpreter when the code is being compiled or executed, and they can prevent the code from running correctly. To fix a syntax error, the code must be revised to conform to the correct syntax of the programming language."
explain program documentation. why is it important?,"Program documentation is written information that describes the design and functionality of a computer program. It can include information about the purpose of the program, the structure of the code, the algorithms used, and the input and output data. Program documentation is important because it helps to make the code easier to understand and maintain. It can be used to document the design decisions made during the development process, which can be helpful for future developers working on the same codebase. Program documentation can also be used as a reference for using the program, and can be helpful for users who are unfamiliar with the code. Overall, program documentation helps to improve the quality and reliability of the code, and makes it easier to modify and update in the future."
what is meant by program documentation?,"Program documentation is written information that describes the design and functionality of a computer program. It can include information about the purpose of the program, the structure of the code, the algorithms used, and the input and output data. Program documentation is important because it helps to make the code easier to understand and maintain. It can be used to document the design decisions made during the development process, which can be helpful for future developers working on the same codebase. Program documentation can also be used as a reference for using the program, and can be helpful for users who are unfamiliar with the code. Overall, program documentation helps to improve the quality and reliability of the code, and makes it easier to modify and update in the future."
why do we need program documentation?,"Program documentation is written information that describes the design and functionality of a computer program. It can include information about the purpose of the program, the structure of the code, the algorithms used, and the input and output data. Program documentation is important because it helps to make the code easier to understand and maintain. It can be used to document the design decisions made during the development process, which can be helpful for future developers working on the same codebase. Program documentation can also be used as a reference for using the program, and can be helpful for users who are unfamiliar with the code. Overall, program documentation helps to improve the quality and reliability of the code, and makes it easier to modify and update in the future."
what is software testing?,"Software testing is the process of evaluating a software system or its component(s) with the intent of finding whether it satisfies the specified requirements or not. Software testing can be done manually or with the use of automated tools. It helps to identify errors, gaps, or missing requirements in the software. There are various types of software testing, including unit testing, integration testing, system testing, and acceptance testing, each of which has a specific focus and purpose. Software testing is an important part of the software development process because it helps to ensure that the software is of high quality and fit for its intended purpose."
how do you explain a data structure?,"A data structure is a way of organizing and storing data in a computer so that it can be accessed and modified efficiently. Different types of data structures are suited to different kinds of applications, and some are highly specialized to specific tasks. Some common data structures include arrays, linked lists, stacks, queues, trees, and graphs. Data structures are an important part of computer science because they provide a means of organizing and storing data in a way that is efficient and easy to use. They are used in many areas of computing, including operating systems, database management systems, and computer networking."
explain what a binary search tree is.,"A binary search tree (BST) is a tree-based data structure in which each node has at most two children and all the nodes in the left subtree of a node have a value less than the node's value, and all the nodes in the right subtree have a value greater than the node's value. This structure allows for fast searching, insertion, and deletion of elements. Binary search trees are often used to store data that needs to be retrieved quickly, such as in the implementation of a dictionary or set data type. They are also used in many other applications, such as for storing and organizing data in databases and for optimizing search algorithms."
what are dynamic data structures?,"Dynamic data structures are data structures that can change in size during the execution of a program. This is in contrast to static data structures, which have a fixed size that is determined when the program is compiled. Dynamic data structures are often implemented using pointers, which allow them to allocate and deallocate memory as needed. Some common dynamic data structures include linked lists, stacks, queues, and trees. Dynamic data structures are useful because they can adapt to changing data needs and do not require the programmer to know the size of the data in advance. However, they can be more complex to implement and may have slower performance than static data structures in some cases."
can you explain doubly linked list?,"A doubly linked list is a linear data structure in which each element is a node that contains a value and two pointers. One pointer points to the previous element in the list, and the other pointer points to the next element in the list. This allows for traversal of the list in both directions. Doubly linked lists are often used when it is necessary to efficiently insert or delete elements from the middle of the list, as they allow for easy manipulation of the pointers. They can also be used to implement stacks and queues. However, doubly linked lists require more memory than some other data structures because each node requires two pointers, rather than just one."
what is logistic regression?,"In machine learning, logistic regression is a type of algorithm used to classify data points into one of two categories. It is a supervised learning algorithm, meaning it requires a labeled dataset to train on. Given a set of input features and a label indicating which category the data point belongs to, the algorithm learns a function that maps the input features to the label. Once trained, the model can be used to predict the label for new, unseen data points. Logistic regression is a popular choice for binary classification problems because it is relatively simple to implement and interpret, and it tends to perform well on a wide range of datasets. It uses sigmoid function as an activation function"
describe decision tree,"A decision tree is a type of machine learning algorithm that is used for classification and regression tasks. It is a tree-like model of decisions and their possible consequences, represented graphically. Each internal node of the tree represents a decision based on the value of a feature, and each leaf node represents a predicted outcome. The tree is constructed by learning from a training dataset, which includes input features and labels indicating the correct category for each data point. To make a prediction for a new, unseen data point, the algorithm follows the path down the tree, making decisions based on the values of the input features and ultimately arriving at a prediction for the label. Decision trees are widely used because they are easy to understand and interpret, and they can handle both categorical and numerical data."
explain confusion matrix,"A confusion matrix is a table that is used to evaluate the performance of a classification algorithm. It is a summary of the predictions made by the algorithm, with the actual class labels on one axis and the predicted class labels on the other. The table shows the number of times each combination of actual and predicted labels occurred. The confusion matrix can be used to calculate various performance metrics, such as precision, recall, and accuracy, which give an indication of how well the algorithm is able to predict the correct class labels. It is a useful tool for understanding the strengths and weaknesses of a classification algorithm and for identifying areas for improvement."
what is bias in data science?,"Bias in data science refers to the systematic error or deviation of a model or algorithm from the true underlying relationship it is attempting to model. Bias can occur for a variety of reasons, such as a poorly chosen model, incomplete or unrepresentative data, or incorrect assumptions about the data. Bias can have negative consequences, such as leading to inaccurate or unfair predictions or decisions. For example, a biased model might consistently overestimate or underestimate the value of a certain variable, or it might unfairly favor certain groups over others. It is important to identify and address bias in data science to ensure that models and algorithms are accurate and fair. This can be done through careful data selection and preprocessing, model selection and evaluation, and ongoing monitoring and testing."
what is dimensionality reduction?,"Dimensionality reduction is a technique used to reduce the number of dimensions (features) in a dataset while preserving as much of the information as possible. It is often used as a preprocessing step before applying machine learning algorithms, as it can help to simplify data, reduce computational complexity, and improve the performance of the model. There are several methods for dimensionality reduction, including feature selection, feature extraction, and manifold learning. Dimensionality reduction is an important tool for working with high-dimensional datasets, which can be difficult to analyze and visualize, and can help to reduce overfitting, improve the interpretability of the results, and reduce the computational cost of training the model."
what is dbms?,"A database management system (DBMS) is a software application that is used to create, manage, and manipulate databases. A database is a collection of data that is organized in a specific way, allowing for efficient retrieval and manipulation of the data. A DBMS provides a set of tools and interfaces that allow users to create, modify, and query the database, as well as to control access to the data and maintain the integrity and consistency of the data. DBMSs are widely used in a variety of applications, including financial systems, customer relationship management systems, and online shopping systems. They are an essential component of many business and organization systems, as they allow for the efficient storage and management of large amounts of data."
explain normalization and de-normalization in databases.,"Normalization is the process of organizing a database in a way that minimizes redundancy and dependency. It involves breaking down a large table into smaller, more specialized tables, and establishing relationships between them using foreign keys. The goal of normalization is to reduce data redundancy, improve data integrity, and make it easier to modify the database structure. De-normalization is the process of reversing normalization, by combining tables or adding redundant data back into the database. It is often done to improve the performance of certain types of queries, at the expense of increased redundancy and a more complex database structure. De-normalization is used in cases where the benefits of faster query performance outweigh the drawbacks of increased data redundancy and complexity. Both normalization and de-normalization are important concepts in database design, and the appropriate approach depends on the specific requirements and goals of the database."
what is bcnf? how it is different from 3nf?,"BCNF (Boyce-Codd Normal Form) is a normal form in database design that is used to ensure that a database is free of certain types of anomalies and dependency issues. It requires that every determinant in the database be a candidate key, which is a set of attributes that uniquely identifies each row in a table. BCNF is more restrictive than 3NF (Third Normal Form), which only requires that the database be in 2NF (Second Normal Form) and that all the non-key attributes in the database be fully dependent on the primary key. BCNF can result in a more complex database structure, with more tables and foreign keys, but it can help to ensure that the database is well-organized and easy to maintain and modify."
what is a degree of relation in dbms?,"The degree of a relation in a database management system (DBMS) refers to the number of attributes it has. A relation with a single attribute is called a unary relation, a relation with two attributes is called a binary relation, and a relation with three or more attributes is called a ternary or higher-order relation. The degree of a relation is an important concept in database design, as it affects the structure and organization of the data."
give an explanation on the difference between strong ai and weak ai?,"Strong AI, also known as artificial general intelligence, refers to artificial intelligence systems that have the ability to perform any intellectual task that a human can. In other words, strong AI systems have a general and flexible intelligence that allows them to adapt to and learn new tasks, rather than being specifically designed for a single task or set of tasks. Weak AI, also known as artificial narrow intelligence, refers to artificial intelligence systems that are designed for a specific task or set of tasks. These systems are not capable of adapting to new tasks or learning new skills. They are often designed to perform a specific function, such as recognizing faces in images or playing a game like chess. In summary, the main difference between strong AI and weak AI is the scope and flexibility of their intelligence. Strong AI systems are capable of adapting to and learning new tasks, while weak AI systems are limited to the specific tasks they were designed for."
define an expert system in ai?,"An expert system is a type of artificial intelligence (AI) system that is designed to mimic the decision-making abilities of a human expert in a particular domain. Expert systems are often used in fields where specialized knowledge is required, such as medicine, engineering, and finance. Expert systems typically consist of a knowledge base, which contains information and rules about the domain, and an inference engine, which uses the knowledge base to draw conclusions and make recommendations. The knowledge base is usually created by experts in the field, who input their knowledge and expertise into the system. The inference engine uses this knowledge to make decisions and provide recommendations based on a set of input data."
what are recurrent neural networks?,"Recurrent neural networks (RNNs) are a type of artificial neural network that are designed to process sequential data. They are particularly useful for tasks that involve processing data with a temporal dimension, such as language translation, speech recognition, and time series prediction. RNNs are composed of units called neurons, which are connected together in a network and are able to pass information from one unit to the next. Unlike traditional neural networks, which process data in a feedforward manner, RNNs have feedback connections, which allow them to retain information from previous time steps and use it to process the current time step. This makes them well-suited for tasks that involve processing data with a temporal dimension, as they are able to consider the context and dependencies between time steps."
what is the difference between supervised and unsupervised machine learning?,"Supervised machine learning and unsupervised machine learning are two categories of machine learning algorithms that are used to train models on data. In supervised machine learning, the training data includes both input features and labeled output values. The goal of supervised learning is to train a model to make predictions about the output values given the input features. This requires the availability of labeled data, which can be used to train the model and evaluate its performance. Examples of supervised learning tasks include classification, regression, and prediction. In unsupervised machine learning, the training data includes only input features and no labeled output values. The goal of unsupervised learning is to find patterns and relationships in the data, rather than making predictions about specific output values. This requires the model to learn from the data itself, without the guidance of labeled outputs. Examples of unsupervised learning tasks include clustering and dimensionality reduction. In summary, the main difference between supervised and unsupervised learning is the availability of labeled data. Supervised learning requires labeled data, while unsupervised learning does not."
what do you understand by the hyperparameter?,"Hyperparameters are parameters that are set before training a machine learning model. They are not learned from the training data, but rather are set manually by the developer. Hyperparameters control the behavior and performance of the model, and can have a significant impact on the accuracy and generalization of the model. Examples of hyperparameters include the learning rate for gradient descent, the regularization coefficient, the number of hidden units in a neural network, and the depth of a decision tree. These hyperparameters are set before training the model, and their values are used to control the training process and the resulting model. Hyperparameter optimization is the process of finding the best values for the hyperparameters of a machine learning model. This can be done manually, through trial and error, or using automated methods such as grid search or random search. Hyperparameter optimization is an important step in the process of developing a machine learning model, as it can have a significant impact on the performance of the model."
what are bayesian networks?,"Bayesian networks are a type of probabilistic graphical model that represent the dependencies between different variables. They are used to represent and reason about uncertain or probabilistic information. Bayesian networks consist of a directed acyclic graph (DAG), in which the nodes represent variables and the edges represent the dependencies between the variables. The variables can be binary (e.g., true/false) or continuous (e.g., real numbers). Each variable is associated with a probability distribution that describes its possible values and the likelihood of each value occurring. The edges in the graph represent the relationships between the variables, and the probabilities in the distributions are used to capture the dependencies between the variables. Bayesian networks are useful for representing complex systems with many variables and dependencies, and can be used to make predictions about the values of variables given the values of other variables. They are commonly used in fields such as machine learning, artificial intelligence, and data analysis."
what is encryption?,"Encryption is the process of converting plain text or data into a coded or unreadable form, often to prevent unauthorized access or tampering. It is commonly used to secure data transmission over the internet or to protect sensitive information stored in databases or other digital systems. There are two types of encryption: symmetric and asymmetric. In symmetric encryption, the same key is used for both encryption and decryption, while in asymmetric encryption, a pair of keys (public and private) is used, with one key used for encryption and the other for decryption. Common encryption algorithms include AES, RSA, and DES."
explain how encryption works.,"Encryption is the process of converting plain text or data into a coded or unreadable form, often to prevent unauthorized access or tampering. It is commonly used to secure data transmission over the internet or to protect sensitive information stored in databases or other digital systems. There are two types of encryption: symmetric and asymmetric. In symmetric encryption, the same key is used for both encryption and decryption, while in asymmetric encryption, a pair of keys (public and private) is used, with one key used for encryption and the other for decryption. Common encryption algorithms include AES, RSA, and DES."
what are the types of encryption?,"Encryption is the process of converting plain text or data into a coded or unreadable form, often to prevent unauthorized access or tampering. It is commonly used to secure data transmission over the internet or to protect sensitive information stored in databases or other digital systems. There are two types of encryption: symmetric and asymmetric. In symmetric encryption, the same key is used for both encryption and decryption, while in asymmetric encryption, a pair of keys (public and private) is used, with one key used for encryption and the other for decryption. Common encryption algorithms include AES, RSA, and DES."
