user,bot
explain shift registers in computer hardware.,"Shift registers are digital circuits used in computer hardware for shifting and storing data in a serial manner. They are commonly used for data storage, data manipulation, and data communication. Shift registers can be implemented using various techniques, such as serial-in, serial-out (SISO), parallel-in, serial-out (PISO), serial-in, parallel-out (SIPO), and parallel-in, parallel-out (PIPO). Shift registers are essential components used in computer systems for data processing, data transmission, and control signal generation."
what are asynchronous counters?,"Asynchronous counters, also known as ripple counters, are digital circuits used in computer hardware for counting events or generating timing signals. They are commonly used for counting and timing applications where the output changes asynchronously with respect to the clock signal. Asynchronous counters can be implemented using various techniques, such as binary counters, decade counters, and up/down counters. They are widely used in computer systems for counting events, generating timing signals, and controlling system operations."
explain asynchronous counters in computer hardware.,"Asynchronous counters, also known as ripple counters, are digital circuits used in computer hardware for counting events or generating timing signals. They are commonly used for counting and timing applications where the output changes asynchronously with respect to the clock signal. Asynchronous counters can be implemented using various techniques, such as binary counters, decade counters, and up/down counters. They are widely used in computer systems for counting events, generating timing signals, and controlling system operations."
what are mealy and moore machines?,"Mealy and Moore machines are types of finite state machines (FSMs) used in computer hardware for designing sequential logic circuits. They are used for controlling system operations, generating control signals, and processing data based on the current state and input signals. Mealy machines produce output signals based on both the current state and input signals, while Moore machines produce output signals based only on the current state. Mealy and Moore machines are essential components used in computer systems for state-based control, data processing, and system operation."
explain mealy and moore machines in computer hardware.,"Mealy and Moore machines are types of finite state machines (FSMs) used in computer hardware for designing sequential logic circuits. They are used for controlling system operations, generating control signals, and processing data based on the current state and input signals. Mealy machines produce output signals based on both the current state and input signals, while Moore machines produce output signals based only on the current state. Mealy and Moore machines are essential components used in computer systems for state-based control, data processing, and system operation."
what are synchronous counters?,"Synchronous counters are digital circuits used in computer hardware for counting events or generating timing signals. They are synchronized with a clock signal, and the output changes simultaneously with the clock edge. Synchronous counters can be implemented using various techniques, such as binary counters, decade counters, and up/down counters. They are widely used in computer systems for counting events, generating timing signals, and controlling system operations."
explain synchronous counters in computer hardware.,"Synchronous counters are digital circuits used in computer hardware for counting events or generating timing signals. They are synchronized with a clock signal, and the output changes simultaneously with the clock edge. Synchronous counters can be implemented using various techniques, such as binary counters, decade counters, and up/down counters. They are widely used in computer systems for counting events, generating timing signals, and controlling system operations."
what are state minimization techniques?,"State minimization techniques are used in digital circuit design to optimize the number of states in a finite state machine (FSM). They reduce the complexity and size of the FSM by eliminating redundant or unreachable states. State minimization techniques, such as state assignment, state encoding, and state reduction, are used to improve the efficiency and performance of digital systems by minimizing the number of states needed to represent the system behavior."
explain state minimization techniques in digital circuit design.,"State minimization techniques are used in digital circuit design to optimize the number of states in a finite state machine (FSM). They reduce the complexity and size of the FSM by eliminating redundant or unreachable states. State minimization techniques, such as state assignment, state encoding, and state reduction, are used to improve the efficiency and performance of digital systems by minimizing the number of states needed to represent the system behavior."
what is read only memory (rom)?,"Read Only Memory (ROM) is a type of computer memory that stores data permanently and cannot be modified after initial programming. It is used for storing firmware, BIOS, and other system-level software that needs to be retained even when the computer is powered off. ROM is non-volatile memory and is widely used in computer systems for storing critical system-level information."
explain read only memory in computer systems.,"Read Only Memory (ROM) is a type of computer memory that stores data permanently and cannot be modified after initial programming. It is used for storing firmware, BIOS, and other system-level software that needs to be retained even when the computer is powered off. ROM is non-volatile memory and is widely used in computer systems for storing critical system-level information."
what is programmable array logic (pal)?,"Programmable Array Logic (PAL) is a type of digital logic device used in digital circuit design for implementing combinational logic functions. It consists of an array of programmable AND gates followed by programmable OR gates, allowing the designer to configure the logic functions based on specific requirements. PAL is a type of programmable logic device (PLD) and is commonly used in digital systems for implementing custom logic functions."
explain programmable array logic in digital circuit design.,"Programmable Array Logic (PAL) is a type of digital logic device used in digital circuit design for implementing combinational logic functions. It consists of an array of programmable AND gates followed by programmable OR gates, allowing the designer to configure the logic functions based on specific requirements. PAL is a type of programmable logic device (PLD) and is commonly used in digital systems for implementing custom logic functions."
what is programmable logic array (pla)?,"Programmable Logic Array (PLA) is a type of digital logic device used in digital circuit design for implementing combinational and sequential logic functions. It consists of an array of programmable AND gates followed by programmable OR gates, along with programmable flip-flops, allowing the designer to configure both combinational and sequential logic functions. PLA is a type of programmable logic device (PLD) and is commonly used in digital systems for implementing custom logic functions."
explain programmable logic array in digital circuit design.,"Programmable Logic Array (PLA) is a type of digital logic device used in digital circuit design for implementing combinational and sequential logic functions. It consists of an array of programmable AND gates followed by programmable OR gates, along with programmable flip-flops, allowing the designer to configure both combinational and sequential logic functions. PLA is a type of programmable logic device (PLD) and is commonly used in digital systems for implementing custom logic functions."
what is instruction set architecture (isa)?,"Instruction Set Architecture (ISA) is a set of instructions and formats used by a computer's central processing unit (CPU) to execute operations or perform tasks. It defines the interface between the hardware and software of a computer system, including the instructions, data types, addressing modes, and memory organization. ISA plays a crucial role in determining the overall performance and functionality of a computer system."
explain instruction set architecture in computer systems.,"Instruction Set Architecture (ISA) is a set of instructions and formats used by a computer's central processing unit (CPU) to execute operations or perform tasks. It defines the interface between the hardware and software of a computer system, including the instructions, data types, addressing modes, and memory organization. ISA plays a crucial role in determining the overall performance and functionality of a computer system."
what is accumulator-based architecture?,"Accumulator-based architecture is a type of computer architecture where the CPU has a dedicated register called an accumulator that is used to store intermediate results during computation. The accumulator serves as a temporary storage location for arithmetic and logical operations, and the results are stored back in the accumulator. Accumulator-based architecture is simple and commonly used in early computer systems and microcontrollers."
explain accumulator-based architecture in computer systems.,"Accumulator-based architecture is a type of computer architecture where the CPU has a dedicated register called an accumulator that is used to store intermediate results during computation. The accumulator serves as a temporary storage location for arithmetic and logical operations, and the results are stored back in the accumulator. Accumulator-based architecture is simple and commonly used in early computer systems and microcontrollers."
what is stack-based architecture?,"Stack-based architecture is a type of computer architecture where the CPU uses a stack to store operands and results during computation. Instead of dedicated registers, operands are pushed onto the stack, and operations are performed using stack-based instructions. Stack-based architecture is used in some special-purpose processors and can simplify instruction decoding and register management."
explain stack-based architecture in computer systems.,"Stack-based architecture is a type of computer architecture where the CPU uses a stack to store operands and results during computation. Instead of dedicated registers, operands are pushed onto the stack, and operations are performed using stack-based instructions. Stack-based architecture is used in some special-purpose processors and can simplify instruction decoding and register management."
what is register-memory architecture?,"Register-Memory architecture is a type of computer architecture where the CPU has both registers and main memory for data storage. Registers are used for temporary storage of operands and results, while main memory serves as a larger, slower storage for data and instructions. Register-Memory architecture is commonly used in modern computer systems as it allows for faster data access and efficient use of registers for computation."
explain register-memory architecture in computer systems.,"Register-Memory architecture is a type of computer architecture where the CPU has both registers and main memory for data storage. Registers are used for temporary storage of operands and results, while main memory serves as a larger, slower storage for data and instructions. Register-Memory architecture is commonly used in modern computer systems as it allows for faster data access and efficient use of registers for computation."
what is register-register architecture?,"Register-Register architecture is a type of computer architecture where the CPU uses registers for both operands and results during computation. Operations are performed directly between registers, and results are stored back in registers. Register-Register architecture is commonly used in modern computer systems as it allows for fast data processing and efficient use of registers for computation."
explain register-register architecture in computer systems.,"Register-Register architecture is a type of computer architecture where the CPU uses registers for both operands and results during computation. Operations are performed directly between registers, and results are stored back in registers. Register-Register architecture is commonly used in modern computer systems as it allows for fast data processing and efficient use of registers for computation."
what are instruction encoding techniques?,"Instruction encoding techniques refer to the methods used to represent and encode instructions in a computer system. This includes determining the format of instructions, specifying the opcode and operands, and defining the instruction set architecture. Instruction encoding techniques are crucial for efficient instruction execution and play a significant role in overall system performance."
explain instruction encoding techniques in computer systems.,"Instruction encoding techniques refer to the methods used to represent and encode instructions in a computer system. This includes determining the format of instructions, specifying the opcode and operands, and defining the instruction set architecture. Instruction encoding techniques are crucial for efficient instruction execution and play a significant role in overall system performance."
what is computer performance?,"Computer performance refers to the measurement of a computer system's ability to execute instructions and process data within a given time period. It is influenced by various factors, including CPU speed, memory capacity, storage capacity, and system architecture. Computer performance is a critical consideration in designing and optimizing computer systems for specific tasks or applications."
explain computer performance in computer systems.,"Computer performance refers to the measurement of a computer system's ability to execute instructions and process data within a given time period. It is influenced by various factors, including CPU speed, memory capacity, storage capacity, and system architecture. Computer performance is a critical consideration in designing and optimizing computer systems for specific tasks or applications."
what are common pitfalls in computer performance?,"Common pitfalls in computer performance include inefficient algorithms, poor memory management, excessive I/O operations, inefficient resource utilization, and suboptimal system configurations. These issues can negatively impact system performance and result in slow execution, high resource usage, and poor responsiveness. Identifying and addressing common pitfalls is essential for optimizing computer performance."
explain common pitfalls in computer systems.,"Common pitfalls in computer performance include inefficient algorithms, poor memory management, excessive I/O operations, inefficient resource utilization, and suboptimal system configurations. These issues can negatively impact system performance and result in slow execution, high resource usage, and poor responsiveness. Identifying and addressing common pitfalls is essential for optimizing computer performance."
what is amdahl's law?,"Amdahl's Law is a formula used to estimate the potential speedup of a computer system by optimizing a portion of the system, while keeping the rest unchanged. It states that the overall speedup is limited by the fraction of the system that is optimized. Amdahl's Law is commonly used to understand the trade-offs and limitations of performance improvements in parallel computing systems."
explain amdahl's law in computer systems.,"Amdahl's Law is a formula used to estimate the potential speedup of a computer system by optimizing a portion of the system, while keeping the rest unchanged. It states that the overall speedup is limited by the fraction of the system that is optimized. Amdahl's Law is commonly used to understand the trade-offs and limitations of performance improvements in parallel computing systems."
what is memory hierarchy?,"Memory hierarchy refers to the organization of different levels of memory in a computer system, ranging from high-speed but small-capacity registers and caches to slower but larger-capacity main memory and secondary storage. Memory hierarchy is designed to optimize the trade-offs between speed, capacity, and cost, and plays a critical role in overall system performance."
explain memory hierarchy in computer systems.,"Memory hierarchy refers to the organization of different levels of memory in a computer system, ranging from high-speed but small-capacity registers and caches to slower but larger-capacity main memory and secondary storage. Memory hierarchy is designed to optimize the trade-offs between speed, capacity, and cost, and plays a critical role in overall system performance."
what is cache memory?,"Cache memory is a small, high-speed memory that sits between the CPU and main memory in a computer system. It stores frequently accessed data and instructions to reduce the CPU's access time to main memory, thereby improving system performance. Cache memory is an important component of the memory hierarchy and is typically organized into multiple levels, such as L1, L2, and L3 caches."
explain cache memory in computer systems.,"Cache memory is a small, high-speed memory that sits between the CPU and main memory in a computer system. It stores frequently accessed data and instructions to reduce the CPU's access time to main memory, thereby improving system performance. Cache memory is an important component of the memory hierarchy and is typically organized into multiple levels, such as L1, L2, and L3 caches."
what are bus standards?,"Bus standards refer to the specifications and protocols used for communication between different hardware components in a computer system. Buses are used to transfer data, addresses, and control signals between CPU, memory, I/O devices, and other hardware components. Examples of bus standards include PCI (Peripheral Component Interconnect), USB (Universal Serial Bus), and SATA (Serial ATA). Bus standards play a crucial role in ensuring compatibility and interoperability among different hardware components."
explain bus standards in computer systems.,"Bus standards refer to the specifications and protocols used for communication between different hardware components in a computer system. Buses are used to transfer data, addresses, and control signals between CPU, memory, I/O devices, and other hardware components. Examples of bus standards include PCI (Peripheral Component Interconnect), USB (Universal Serial Bus), and SATA (Serial ATA). Bus standards play a crucial role in ensuring compatibility and interoperability among different hardware components."
what are arbitration schemes?,"Arbitration schemes are used to manage access to shared resources, such as buses or memory, in a computer system. They determine how requests for access to shared resources are prioritized and granted. Common arbitration schemes include priority-based, round-robin, and token-based schemes. Arbitration schemes are crucial for managing concurrent access to shared resources and ensuring fair and efficient resource allocation."
explain arbitration schemes in computer systems.,"Arbitration schemes are used to manage access to shared resources, such as buses or memory, in a computer system. They determine how requests for access to shared resources are prioritized and granted. Common arbitration schemes include priority-based, round-robin, and token-based schemes. Arbitration schemes are crucial for managing concurrent access to shared resources and ensuring fair and efficient resource allocation."
what is programmed i/o?,"Programmed I/O is a method of input/output (I/O) operation in a computer system where the CPU directly controls the transfer of data between the CPU and I/O devices. In programmed I/O, the CPU executes I/O instructions to read from or write to I/O devices, and the CPU is responsible for managing the entire I/O operation. Programmed I/O is simple but can be inefficient as it requires the CPU to wait for I/O operations to complete."
explain programmed i/o in computer systems.,"Programmed I/O is a method of input/output (I/O) operation in a computer system where the CPU directly controls the transfer of data between the CPU and I/O devices. In programmed I/O, the CPU executes I/O instructions to read from or write to I/O devices, and the CPU is responsible for managing the entire I/O operation. Programmed I/O is simple but can be inefficient as it requires the CPU to wait for I/O operations to complete."
what is interrupt-driven i/o?,"Interrupt-driven I/O is a method of input/output (I/O) operation in a computer system where I/O devices generate interrupts to notify the CPU when they are ready to send or receive data. When an interrupt is received, the CPU suspends its current execution and jumps to an interrupt service routine (ISR) to handle the I/O operation. Interrupt-driven I/O allows the CPU to perform other tasks while waiting for I/O operations to complete, improving overall system efficiency."
explain interrupt-driven i/o in computer systems.,"Interrupt-driven I/O is a method of input/output (I/O) operation in a computer system where I/O devices generate interrupts to notify the CPU when they are ready to send or receive data. When an interrupt is received, the CPU suspends its current execution and jumps to an interrupt service routine (ISR) to handle the I/O operation. Interrupt-driven I/O allows the CPU to perform other tasks while waiting for I/O operations to complete, improving overall system efficiency."
what is direct memory access (dma)?,"Direct Memory Access (DMA) is a technique that allows I/O devices to transfer data directly to or from main memory without involving the CPU. DMA offloads the CPU from the time-consuming task of transferring data, improving system performance. DMA controllers manage the data transfer process, and the CPU is only involved in setting up the DMA operation and handling interrupts when the transfer is complete."
explain dma in computer systems.,"Direct Memory Access (DMA) is a technique that allows I/O devices to transfer data directly to or from main memory without involving the CPU. DMA offloads the CPU from the time-consuming task of transferring data, improving system performance. DMA controllers manage the data transfer process, and the CPU is only involved in setting up the DMA operation and handling interrupts when the transfer is complete."
what is cap theorem?,"CAP Theorem, also known as Brewer's Theorem, states that in a distributed database system, it is impossible to simultaneously guarantee consistency, availability, and partition tolerance. According to CAP Theorem, in the event of a network partition, a distributed database system must choose between maintaining consistency (all nodes have the same data), availability (all requests receive a response), or partition tolerance (system continues to operate despite network failures). This theorem has important implications for the design and trade-offs in distributed databases."
explain cap theorem in distributed databases.,"CAP Theorem, also known as Brewer's Theorem, states that in a distributed database system, it is impossible to simultaneously guarantee consistency, availability, and partition tolerance. According to CAP Theorem, in the event of a network partition, a distributed database system must choose between maintaining consistency (all nodes have the same data), availability (all requests receive a response), or partition tolerance (system continues to operate despite network failures). This theorem has important implications for the design and trade-offs in distributed databases."
what are distributed databases?,"Distributed databases are databases that are spread across multiple nodes or servers in a computer network. Each node may store a subset of data and may have its own processing power. Distributed databases allow for scalable and fault-tolerant data storage and processing, as well as efficient data access and retrieval. However, managing consistency, availability, and partition tolerance can be challenging in distributed databases, and various techniques and algorithms are used to ensure data integrity and reliability."
explain distributed databases.,"Distributed databases are databases that are spread across multiple nodes or servers in a computer network. Each node may store a subset of data and may have its own processing power. Distributed databases allow for scalable and fault-tolerant data storage and processing, as well as efficient data access and retrieval. However, managing consistency, availability, and partition tolerance can be challenging in distributed databases, and various techniques and algorithms are used to ensure data integrity and reliability."
what are decision support systems?,"Decision Support Systems (DSS) are computer-based systems that provide analytical tools and information to support decision-making processes in organizations. DSS can analyze large amounts of data, generate reports, and provide interactive interfaces for decision-makers to explore different scenarios and make informed decisions. DSS are commonly used in business, finance, healthcare, and other domains where complex decisions need to be made based on data analysis and modeling."
