user,bot
explain stochastic gradient descent.,"Stochastic Gradient Descent (SGD) is an optimization algorithm commonly used in machine learning for training models. It is a variant of the gradient descent algorithm that updates the model parameters based on a single data point or a small subset of data points at a time, making it computationally efficient for large datasets. SGD is widely used in training deep neural networks and other large-scale machine learning models."
what is the backpropagation algorithm in machine learning?,The Backpropagation Algorithm is a widely used optimization algorithm for training artificial neural networks. It is a supervised learning algorithm that uses a gradient-based approach to update the model weights based on the error between the predicted output and the actual output. Backpropagation calculates the gradient of the error with respect to the model weights and uses it to adjust the weights iteratively during the training process.
explain backpropagation algorithm.,The Backpropagation Algorithm is a widely used optimization algorithm for training artificial neural networks. It is a supervised learning algorithm that uses a gradient-based approach to update the model weights based on the error between the predicted output and the actual output. Backpropagation calculates the gradient of the error with respect to the model weights and uses it to adjust the weights iteratively during the training process.
hello,Hello! Welcome to MarAcademy. How can I help you today?
hey,Hello! Welcome to MarAcademy. How can I help you today?
good morning,Hello! Welcome to MarAcademy. How can I help you today?
good evening,Hello! Welcome to MarAcademy. How can I help you today?
what is maracademy?,"MarAcademy is an education platform committed to making high-quality tech education accessible to everyone. We offer expertly designed courses, mentorship, fully-funded scholarships, and support to help learners gain industry-ready skills."
tell me about maracademy,"MarAcademy is an education platform committed to making high-quality tech education accessible to everyone. We offer expertly designed courses, mentorship, fully-funded scholarships, and support to help learners gain industry-ready skills."
who are you guys?,"MarAcademy is an education platform committed to making high-quality tech education accessible to everyone. We offer expertly designed courses, mentorship, fully-funded scholarships, and support to help learners gain industry-ready skills."
what do you do at maracademy?,"MarAcademy is an education platform committed to making high-quality tech education accessible to everyone. We offer expertly designed courses, mentorship, fully-funded scholarships, and support to help learners gain industry-ready skills."
who founded maracademy?,"The founder and Executive Director of MarAcademy is Omar Keita. He is a student and web developer from The Gambia, deeply passionate about technology, education, and helping learners succeed. He leads the vision, strategy, and growth of MarAcademy, ensuring access, quality, and mentorship in everything we do."
tell me about omar keita,"The founder and Executive Director of MarAcademy is Omar Keita. He is a student and web developer from The Gambia, deeply passionate about technology, education, and helping learners succeed. He leads the vision, strategy, and growth of MarAcademy, ensuring access, quality, and mentorship in everything we do."
who is the founder?,"The founder and Executive Director of MarAcademy is Omar Keita. He is a student and web developer from The Gambia, deeply passionate about technology, education, and helping learners succeed. He leads the vision, strategy, and growth of MarAcademy, ensuring access, quality, and mentorship in everything we do."
tell me more about omar keita,"Omar Keita is from The Gambia. He is a web developer and student, who enjoys reading, coding, and technology generally. His motivation is to use tech and education to empower learners. He founded MarAcademy to make quality tech education accessible."
what is omar's background?,"Omar Keita is from The Gambia. He is a web developer and student, who enjoys reading, coding, and technology generally. His motivation is to use tech and education to empower learners. He founded MarAcademy to make quality tech education accessible."
who is omar outside maracademy?,"Omar Keita is from The Gambia. He is a web developer and student, who enjoys reading, coding, and technology generally. His motivation is to use tech and education to empower learners. He founded MarAcademy to make quality tech education accessible."
what is your mission?,"Our mission: to empower learners by providing expertly crafted courses, hands-on mentorship, and fully-funded scholarships so financial barriers dont limit access to quality education. Our vision: a world where high-quality education is accessible to everyone, regardless of background, enabling learners to transform their lives through knowledge."
what is maracademys vision?,"Our mission: to empower learners by providing expertly crafted courses, hands-on mentorship, and fully-funded scholarships so financial barriers dont limit access to quality education. Our vision: a world where high-quality education is accessible to everyone, regardless of background, enabling learners to transform their lives through knowledge."
tell me your mission and vision,"Our mission: to empower learners by providing expertly crafted courses, hands-on mentorship, and fully-funded scholarships so financial barriers dont limit access to quality education. Our vision: a world where high-quality education is accessible to everyone, regardless of background, enabling learners to transform their lives through knowledge."
what do you offer?,"Heres what we offer at MarAcademy:  Expert Courses (industry-driven, real-world skills)  Hands-On Learning (interactive projects and exercises)  Fully-Funded Scholarships  Mentorship & Support  Career Resources (resume help, interview prep)  Collaborative Community  Flexible Learning (self-paced courses)"
courses and services,"Heres what we offer at MarAcademy:  Expert Courses (industry-driven, real-world skills)  Hands-On Learning (interactive projects and exercises)  Fully-Funded Scholarships  Mentorship & Support  Career Resources (resume help, interview prep)  Collaborative Community  Flexible Learning (self-paced courses)"
what can i get from maracademy?,"Heres what we offer at MarAcademy:  Expert Courses (industry-driven, real-world skills)  Hands-On Learning (interactive projects and exercises)  Fully-Funded Scholarships  Mentorship & Support  Career Resources (resume help, interview prep)  Collaborative Community  Flexible Learning (self-paced courses)"
tell me what you offer,"Heres what we offer at MarAcademy:  Expert Courses (industry-driven, real-world skills)  Hands-On Learning (interactive projects and exercises)  Fully-Funded Scholarships  Mentorship & Support  Career Resources (resume help, interview prep)  Collaborative Community  Flexible Learning (self-paced courses)"
what courses do you have?,Here are some of our featured courses:  Data Science with Python / R  Data Analysis with SQL / Python  Machine Learning with Python  Data Engineering with Python You can see more on DataCamp via our partnership.
show me your courses,Here are some of our featured courses:  Data Science with Python / R  Data Analysis with SQL / Python  Machine Learning with Python  Data Engineering with Python You can see more on DataCamp via our partnership.
which courses are available?,Here are some of our featured courses:  Data Science with Python / R  Data Analysis with SQL / Python  Machine Learning with Python  Data Engineering with Python You can see more on DataCamp via our partnership.
tell me courses,Here are some of our featured courses:  Data Science with Python / R  Data Analysis with SQL / Python  Machine Learning with Python  Data Engineering with Python You can see more on DataCamp via our partnership.
how can i contact you?,You can reach us via phone or email: Phone: +220 3020789 Email: maracademygambia@gmail.com Feel free to message us with any questions!
your email and phone,You can reach us via phone or email: Phone: +220 3020789 Email: maracademygambia@gmail.com Feel free to message us with any questions!
contact maracademy,You can reach us via phone or email: Phone: +220 3020789 Email: maracademygambia@gmail.com Feel free to message us with any questions!
get in touch,You can reach us via phone or email: Phone: +220 3020789 Email: maracademygambia@gmail.com Feel free to message us with any questions!
how do i apply?,"To apply, please visit our website and click on Apply Now. We provide fully-funded scholarships to eligible learners. Let me know if you want the link or guidance through the application."
apply now,"To apply, please visit our website and click on Apply Now. We provide fully-funded scholarships to eligible learners. Let me know if you want the link or guidance through the application."
i want to join,"To apply, please visit our website and click on Apply Now. We provide fully-funded scholarships to eligible learners. Let me know if you want the link or guidance through the application."
application process,"To apply, please visit our website and click on Apply Now. We provide fully-funded scholarships to eligible learners. Let me know if you want the link or guidance through the application."
who are your partners?,"One of our key partners is DataCamp, through which we offer course content and collaboration. We also partner with initiatives like DataCamp Donates to expand access."
partner organizations,"One of our key partners is DataCamp, through which we offer course content and collaboration. We also partner with initiatives like DataCamp Donates to expand access."
who do you work with?,"One of our key partners is DataCamp, through which we offer course content and collaboration. We also partner with initiatives like DataCamp Donates to expand access."
tell me about you,"Omar Keita is a student at African Leadership University (ALU) in Kigali, Rwanda, majoring in Software Engineering (Bachelor of Science Honours), starting in May 2023. He is from The Gambia."
who is omar keita?,"Omar Keita is a student at African Leadership University (ALU) in Kigali, Rwanda, majoring in Software Engineering (Bachelor of Science Honours), starting in May 2023. He is from The Gambia."
what is your background?,"Omar Keita is a student at African Leadership University (ALU) in Kigali, Rwanda, majoring in Software Engineering (Bachelor of Science Honours), starting in May 2023. He is from The Gambia."
who is the founder of maracademy?,"Omar Keita is a student at African Leadership University (ALU) in Kigali, Rwanda, majoring in Software Engineering (Bachelor of Science Honours), starting in May 2023. He is from The Gambia."
what are your skills?,"Omar Keita is a student at African Leadership University (ALU) in Kigali, Rwanda, majoring in Software Engineering (Bachelor of Science Honours), starting in May 2023. He is from The Gambia."
show me omar keita's profile,"Omar Keita is a student at African Leadership University (ALU) in Kigali, Rwanda, majoring in Software Engineering (Bachelor of Science Honours), starting in May 2023. He is from The Gambia."
what does omar do?,"Omar Keita is a student at African Leadership University (ALU) in Kigali, Rwanda, majoring in Software Engineering (Bachelor of Science Honours), starting in May 2023. He is from The Gambia."
what is omar's education?,"Omar Keita is a student at African Leadership University (ALU) in Kigali, Rwanda, majoring in Software Engineering (Bachelor of Science Honours), starting in May 2023. He is from The Gambia."
what is omar keita's experience?,"Omar Keita is a student at African Leadership University (ALU) in Kigali, Rwanda, majoring in Software Engineering (Bachelor of Science Honours), starting in May 2023. He is from The Gambia."
what projects has omar done?,"Omar Keita is a student at African Leadership University (ALU) in Kigali, Rwanda, majoring in Software Engineering (Bachelor of Science Honours), starting in May 2023. He is from The Gambia."
what are omar's interests?,"Omar Keita is a student at African Leadership University (ALU) in Kigali, Rwanda, majoring in Software Engineering (Bachelor of Science Honours), starting in May 2023. He is from The Gambia."
what is an algorithm?,"An algorithm is a set of instructions or rules to follow in order to complete a specific task. Algorithms can be particularly useful when youre working with big data or machine learning. Data analysts may use algorithms to organize or analyze data, while data scientists may use algorithms to make predictions or build models."
explain algorithm.,"An algorithm is a set of instructions or rules to follow in order to complete a specific task. Algorithms can be particularly useful when youre working with big data or machine learning. Data analysts may use algorithms to organize or analyze data, while data scientists may use algorithms to make predictions or build models."
define algorithm.,"An algorithm is a set of instructions or rules to follow in order to complete a specific task. Algorithms can be particularly useful when youre working with big data or machine learning. Data analysts may use algorithms to organize or analyze data, while data scientists may use algorithms to make predictions or build models."
how are algorithms used in data science?,"An algorithm is a set of instructions or rules to follow in order to complete a specific task. Algorithms can be particularly useful when youre working with big data or machine learning. Data analysts may use algorithms to organize or analyze data, while data scientists may use algorithms to make predictions or build models."
what is artificial intelligence?,"<a href=""https://www.coursera.org/articles/ai-vs-deep-learning-vs-machine-learning-beginners-guide"" target=""_self"" rel="""">Artificial intelligence</a> (AI) uses computer science and data to enable problem solving in machines. In this case, the intelligence is artificial because its a computer programmed to perform tasks commonly associated with human intelligence."
explain artificial intelligence.,"<a href=""https://www.coursera.org/articles/ai-vs-deep-learning-vs-machine-learning-beginners-guide"" target=""_self"" rel="""">Artificial intelligence</a> (AI) uses computer science and data to enable problem solving in machines. In this case, the intelligence is artificial because its a computer programmed to perform tasks commonly associated with human intelligence."
define ai.,"<a href=""https://www.coursera.org/articles/ai-vs-deep-learning-vs-machine-learning-beginners-guide"" target=""_self"" rel="""">Artificial intelligence</a> (AI) uses computer science and data to enable problem solving in machines. In this case, the intelligence is artificial because its a computer programmed to perform tasks commonly associated with human intelligence."
how is artificial intelligence used?,"<a href=""https://www.coursera.org/articles/ai-vs-deep-learning-vs-machine-learning-beginners-guide"" target=""_self"" rel="""">Artificial intelligence</a> (AI) uses computer science and data to enable problem solving in machines. In this case, the intelligence is artificial because its a computer programmed to perform tasks commonly associated with human intelligence."
what is big data?,"<a href=""https://www.coursera.org/articles/what-is-big-data-a-laypersons-guide"" target=""_self"" rel="""">Big data</a> is a large collection of data characterized by the three Vs: volume, velocity and variety. Volume refers to the amount of databig data deals with high volumes of data; velocity refers to the rate at which data is collectedbig data is collected at a high velocity and often streams directly into memory; and variety refers to the range of data formatsbig data tends to have a high variety of structured, semi-structured, and unstructured data, as well as a variety of formats such as numbers, text strings, images, and audio."
explain big data.,"<a href=""https://www.coursera.org/articles/what-is-big-data-a-laypersons-guide"" target=""_self"" rel="""">Big data</a> is a large collection of data characterized by the three Vs: volume, velocity and variety. Volume refers to the amount of databig data deals with high volumes of data; velocity refers to the rate at which data is collectedbig data is collected at a high velocity and often streams directly into memory; and variety refers to the range of data formatsbig data tends to have a high variety of structured, semi-structured, and unstructured data, as well as a variety of formats such as numbers, text strings, images, and audio."
define big data.,"<a href=""https://www.coursera.org/articles/what-is-big-data-a-laypersons-guide"" target=""_self"" rel="""">Big data</a> is a large collection of data characterized by the three Vs: volume, velocity and variety. Volume refers to the amount of databig data deals with high volumes of data; velocity refers to the rate at which data is collectedbig data is collected at a high velocity and often streams directly into memory; and variety refers to the range of data formatsbig data tends to have a high variety of structured, semi-structured, and unstructured data, as well as a variety of formats such as numbers, text strings, images, and audio."
what are the three v's of big data?,"<a href=""https://www.coursera.org/articles/what-is-big-data-a-laypersons-guide"" target=""_self"" rel="""">Big data</a> is a large collection of data characterized by the three Vs: volume, velocity and variety. Volume refers to the amount of databig data deals with high volumes of data; velocity refers to the rate at which data is collectedbig data is collected at a high velocity and often streams directly into memory; and variety refers to the range of data formatsbig data tends to have a high variety of structured, semi-structured, and unstructured data, as well as a variety of formats such as numbers, text strings, images, and audio."
what is business intelligence?,"Business intelligence (BI) is data analytics used to empower organizations to make data-driven business decisions. <a href=""https://www.coursera.org/articles/business-intelligence-analysts-what-they-are-and-how-to-become-one"" target=""_self"" rel="""">Business intelligence analysts</a> analyze business data like revenue, sales, or customer data, and offer recommendations based on their analysis."
explain business intelligence.,"Business intelligence (BI) is data analytics used to empower organizations to make data-driven business decisions. <a href=""https://www.coursera.org/articles/business-intelligence-analysts-what-they-are-and-how-to-become-one"" target=""_self"" rel="""">Business intelligence analysts</a> analyze business data like revenue, sales, or customer data, and offer recommendations based on their analysis."
define bi.,"Business intelligence (BI) is data analytics used to empower organizations to make data-driven business decisions. <a href=""https://www.coursera.org/articles/business-intelligence-analysts-what-they-are-and-how-to-become-one"" target=""_self"" rel="""">Business intelligence analysts</a> analyze business data like revenue, sales, or customer data, and offer recommendations based on their analysis."
how do business intelligence analysts work?,"Business intelligence (BI) is data analytics used to empower organizations to make data-driven business decisions. <a href=""https://www.coursera.org/articles/business-intelligence-analysts-what-they-are-and-how-to-become-one"" target=""_self"" rel="""">Business intelligence analysts</a> analyze business data like revenue, sales, or customer data, and offer recommendations based on their analysis."
what is a changelog?,A changelog is a list documenting all of the steps you took when working with your data. This can be helpful in the event that you need to return to your original data or recall how you prepared your data for analysis.
explain changelog.,A changelog is a list documenting all of the steps you took when working with your data. This can be helpful in the event that you need to return to your original data or recall how you prepared your data for analysis.
define changelog.,A changelog is a list documenting all of the steps you took when working with your data. This can be helpful in the event that you need to return to your original data or recall how you prepared your data for analysis.
what is the purpose of a changelog?,A changelog is a list documenting all of the steps you took when working with your data. This can be helpful in the event that you need to return to your original data or recall how you prepared your data for analysis.
what is classification?,"Classification is a machine learning problem that organizes data into categories. You may use this to create email spam filters, for example. Some examples of algorithms commonly used to create classification models are logistic regression, decision trees, K-nearest neighbor (KNN), and random forest."
explain classification.,"Classification is a machine learning problem that organizes data into categories. You may use this to create email spam filters, for example. Some examples of algorithms commonly used to create classification models are logistic regression, decision trees, K-nearest neighbor (KNN), and random forest."
define classification.,"Classification is a machine learning problem that organizes data into categories. You may use this to create email spam filters, for example. Some examples of algorithms commonly used to create classification models are logistic regression, decision trees, K-nearest neighbor (KNN), and random forest."
what algorithms are used for classification?,"Classification is a machine learning problem that organizes data into categories. You may use this to create email spam filters, for example. Some examples of algorithms commonly used to create classification models are logistic regression, decision trees, K-nearest neighbor (KNN), and random forest."
what is a dashboard?,"A <a href=""https://www.coursera.org/articles/what-is-dashboard"" target=""_self"" rel="""">dashboard</a> is a tool used to monitor and display live data. Dashboards are typically connected to databases and feature visualizations that automatically update to reflect the most current data in the database."
explain dashboard.,"A <a href=""https://www.coursera.org/articles/what-is-dashboard"" target=""_self"" rel="""">dashboard</a> is a tool used to monitor and display live data. Dashboards are typically connected to databases and feature visualizations that automatically update to reflect the most current data in the database."
define dashboard.,"A <a href=""https://www.coursera.org/articles/what-is-dashboard"" target=""_self"" rel="""">dashboard</a> is a tool used to monitor and display live data. Dashboards are typically connected to databases and feature visualizations that automatically update to reflect the most current data in the database."
how are dashboards used in data analysis?,"A <a href=""https://www.coursera.org/articles/what-is-dashboard"" target=""_self"" rel="""">dashboard</a> is a tool used to monitor and display live data. Dashboards are typically connected to databases and feature visualizations that automatically update to reflect the most current data in the database."
what is data analytics?,"<a href=""https://www.coursera.org/articles/data-analytics"" target=""_self"" rel="""">Data analytics</a> is the collection, transformation, and organization of data in order to draw conclusions, make predictions, and drive informed decision making. Data analytics encompasses data analysis (the process of deriving information from data), data science (using data to theorize and forecast) and data engineering (building data systems). Data analysts, data scientists, and data engineers are all data analytics professionals."
explain data analytics.,"<a href=""https://www.coursera.org/articles/data-analytics"" target=""_self"" rel="""">Data analytics</a> is the collection, transformation, and organization of data in order to draw conclusions, make predictions, and drive informed decision making. Data analytics encompasses data analysis (the process of deriving information from data), data science (using data to theorize and forecast) and data engineering (building data systems). Data analysts, data scientists, and data engineers are all data analytics professionals."
define data analytics.,"<a href=""https://www.coursera.org/articles/data-analytics"" target=""_self"" rel="""">Data analytics</a> is the collection, transformation, and organization of data in order to draw conclusions, make predictions, and drive informed decision making. Data analytics encompasses data analysis (the process of deriving information from data), data science (using data to theorize and forecast) and data engineering (building data systems). Data analysts, data scientists, and data engineers are all data analytics professionals."
what do data analytics professionals do?,"<a href=""https://www.coursera.org/articles/data-analytics"" target=""_self"" rel="""">Data analytics</a> is the collection, transformation, and organization of data in order to draw conclusions, make predictions, and drive informed decision making. Data analytics encompasses data analysis (the process of deriving information from data), data science (using data to theorize and forecast) and data engineering (building data systems). Data analysts, data scientists, and data engineers are all data analytics professionals."
