user,bot
what are javascript frameworks?,"JavaScript is a widely used programming language for building dynamic websites and web applications. JavaScript data types include primitive types such as numbers, strings, booleans, null, and undefined, as well as complex types such as objects and arrays. JavaScript frameworks are pre-written libraries or collections of reusable code that provide a structure and set of tools for developing web applications, such as Angular, React, and Vue."
what is react?,"React is a popular JavaScript library for building user interfaces, particularly for web applications. React components are the building blocks of a React application, representing different parts of the user interface. Components can be reused and combined to create complex user interfaces. React hooks are functions that allow state and lifecycle features to be used in functional components, such as useState for managing component state and useEffect for handling side effects."
explain react components.,"React is a popular JavaScript library for building user interfaces, particularly for web applications. React components are the building blocks of a React application, representing different parts of the user interface. Components can be reused and combined to create complex user interfaces. React hooks are functions that allow state and lifecycle features to be used in functional components, such as useState for managing component state and useEffect for handling side effects."
what are react hooks?,"React is a popular JavaScript library for building user interfaces, particularly for web applications. React components are the building blocks of a React application, representing different parts of the user interface. Components can be reused and combined to create complex user interfaces. React hooks are functions that allow state and lifecycle features to be used in functional components, such as useState for managing component state and useEffect for handling side effects."
what is the difference between conventional and object-oriented programming?,"Conventional programming is a procedural approach where programs are organized as a sequence of tasks or functions, while object-oriented programming (OOP) is a paradigm that uses objects as the fundamental building blocks of a program. In OOP, data and functions (methods) are encapsulated together in objects, allowing for better modularity, reusability, and code organization. OOP also supports concepts such as inheritance, polymorphism, and encapsulation, which are not present in conventional programming."
compare conventional and object-oriented programming.,"Conventional programming is a procedural approach where programs are organized as a sequence of tasks or functions, while object-oriented programming (OOP) is a paradigm that uses objects as the fundamental building blocks of a program. In OOP, data and functions (methods) are encapsulated together in objects, allowing for better modularity, reusability, and code organization. OOP also supports concepts such as inheritance, polymorphism, and encapsulation, which are not present in conventional programming."
what is data abstraction?,"Data abstraction is a technique used in programming to hide the implementation details of data types and only expose their essential properties and behaviors. It allows programmers to create abstract data types (ADTs) that define the interface and operations of a data type without revealing how it is implemented. This separation of interface from implementation allows for better code maintainability, flexibility, and modularity."
explain data abstraction in programming.,"Data abstraction is a technique used in programming to hide the implementation details of data types and only expose their essential properties and behaviors. It allows programmers to create abstract data types (ADTs) that define the interface and operations of a data type without revealing how it is implemented. This separation of interface from implementation allows for better code maintainability, flexibility, and modularity."
"what are objects, classes, and methods in programming?","In object-oriented programming (OOP), objects are instances of a class, which is a blueprint or template for creating objects. A class is a user-defined data type that encapsulates data (attributes) and functions (methods) that operate on that data. Methods are the actions or behaviors that objects of a class can perform. Objects are created from a class using a process called instantiation, and methods are called on objects to perform specific tasks."
"explain the concept of objects, classes, and methods.","In object-oriented programming (OOP), objects are instances of a class, which is a blueprint or template for creating objects. A class is a user-defined data type that encapsulates data (attributes) and functions (methods) that operate on that data. Methods are the actions or behaviors that objects of a class can perform. Objects are created from a class using a process called instantiation, and methods are called on objects to perform specific tasks."
what are constructors in programming?,"Constructors are special methods in object-oriented programming that are used to initialize objects of a class. They are called automatically when an object is created from a class and are used to set the initial values of the attributes of the object. Constructors have the same name as the class and do not have any return type. They can be used to set default values, allocate memory, and perform other initialization tasks for objects."
explain the concept of constructors.,"Constructors are special methods in object-oriented programming that are used to initialize objects of a class. They are called automatically when an object is created from a class and are used to set the initial values of the attributes of the object. Constructors have the same name as the class and do not have any return type. They can be used to set default values, allocate memory, and perform other initialization tasks for objects."
what are destructors in programming?,"Destructors are special methods in object-oriented programming that are used to clean up resources and perform cleanup operations before an object is destroyed or deleted. They are called automatically when an object goes out of scope or is explicitly deleted. Destructors have the same name as the class, preceded by a tilde (~), and do not have any return type. They can be used to free memory, close file handles, and perform other cleanup tasks for objects."
explain the concept of destructors.,"Destructors are special methods in object-oriented programming that are used to clean up resources and perform cleanup operations before an object is destroyed or deleted. They are called automatically when an object goes out of scope or is explicitly deleted. Destructors have the same name as the class, preceded by a tilde (~), and do not have any return type. They can be used to free memory, close file handles, and perform other cleanup tasks for objects."
what is operator overloading in programming?,"Operator overloading is a feature in some programming languages that allows operators (such as +, -, *, /) to have different meanings or behaviors depending on the context or operands they are used with. It allows programmers to define how operators should behave when applied to objects of user-defined classes, in addition to their usual meanings for built-in types. Operator overloading can make code more concise and expressive, but should be used judiciously to avoid confusion."
explain the concept of operator overloading.,"Operator overloading is a feature in some programming languages that allows operators (such as +, -, *, /) to have different meanings or behaviors depending on the context or operands they are used with. It allows programmers to define how operators should behave when applied to objects of user-defined classes, in addition to their usual meanings for built-in types. Operator overloading can make code more concise and expressive, but should be used judiciously to avoid confusion."
what are class and function templates in generic programming?,"Class and function templates are features in some programming languages that allow the creation of generic, reusable code that can work with different data types. Class templates are used to define generic classes that can have placeholders for data types, which are specified when objects of the class are created. Function templates are used to define generic functions that can operate on different data types, which are inferred or explicitly specified during function calls. Templates provide flexibility and code reuse in generic programming."
explain the concept of class and function templates.,"Class and function templates are features in some programming languages that allow the creation of generic, reusable code that can work with different data types. Class templates are used to define generic classes that can have placeholders for data types, which are specified when objects of the class are created. Function templates are used to define generic functions that can operate on different data types, which are inferred or explicitly specified during function calls. Templates provide flexibility and code reuse in generic programming."
what is inheritance in object-oriented programming?,"Inheritance is a concept in object-oriented programming (OOP) where a class can inherit properties and behaviors from another class. The class that is inherited from is called the parent or base class, and the class that inherits from it is called the child or derived class. Inheritance allows for code reuse and promotes code organization and modularity. The child class can inherit attributes, methods, and other members of the parent class, and can also override or extend them to customize its behavior."
explain the concept of inheritance.,"Inheritance is a concept in object-oriented programming (OOP) where a class can inherit properties and behaviors from another class. The class that is inherited from is called the parent or base class, and the class that inherits from it is called the child or derived class. Inheritance allows for code reuse and promotes code organization and modularity. The child class can inherit attributes, methods, and other members of the parent class, and can also override or extend them to customize its behavior."
what is multiple inheritance in object-oriented programming?,"Multiple inheritance is a feature in some object-oriented programming languages that allows a class to inherit properties and behaviors from more than one parent class. This means that a child class can inherit attributes, methods, and other members from multiple classes. Multiple inheritance can provide more flexibility in designing class hierarchies and code reuse, but it can also lead to complexities and ambiguities. Some programming languages support multiple inheritance, while others do not."
explain the concept of multiple inheritance.,"Multiple inheritance is a feature in some object-oriented programming languages that allows a class to inherit properties and behaviors from more than one parent class. This means that a child class can inherit attributes, methods, and other members from multiple classes. Multiple inheritance can provide more flexibility in designing class hierarchies and code reuse, but it can also lead to complexities and ambiguities. Some programming languages support multiple inheritance, while others do not."
what is polymorphism in object-oriented programming?,"Polymorphism is a concept in object-oriented programming (OOP) where objects of different classes can be treated as if they are of the same type. This allows for writing generic code that can work with objects of different classes, as long as they implement the same interface or have the same behavior. Polymorphism promotes code flexibility, reusability, and extensibility. Polymorphism can be achieved through interfaces, abstract classes, virtual functions, and other mechanisms in OOP."
explain the concept of polymorphism.,"Polymorphism is a concept in object-oriented programming (OOP) where objects of different classes can be treated as if they are of the same type. This allows for writing generic code that can work with objects of different classes, as long as they implement the same interface or have the same behavior. Polymorphism promotes code flexibility, reusability, and extensibility. Polymorphism can be achieved through interfaces, abstract classes, virtual functions, and other mechanisms in OOP."
what is aggregation in object-oriented programming?,"Aggregation is a relationship between objects in object-oriented programming (OOP) where one object contains or is composed of other objects, but the contained objects can exist independently of the containing object. Aggregation is a form of association, where objects are connected in a whole-part relationship. Aggregation allows for creating complex objects by combining simpler objects, and it promotes code reuse and modularity. Aggregation is commonly used for modeling relationships such as has-a or part-of between objects."
explain the concept of aggregation.,"Aggregation is a relationship between objects in object-oriented programming (OOP) where one object contains or is composed of other objects, but the contained objects can exist independently of the containing object. Aggregation is a form of association, where objects are connected in a whole-part relationship. Aggregation allows for creating complex objects by combining simpler objects, and it promotes code reuse and modularity. Aggregation is commonly used for modeling relationships such as has-a or part-of between objects."
what is program debugging and testing?,"Program debugging is the process of identifying and fixing errors or bugs in a software program. It involves using debugging tools, techniques, and strategies to trace and isolate issues in the code. Program testing is the process of evaluating a software program to ensure that it behaves as expected and meets its intended requirements. It involves designing and executing tests, analyzing test results, and verifying the correctness and reliability of the program."
explain the concept of program debugging and testing.,"Program debugging is the process of identifying and fixing errors or bugs in a software program. It involves using debugging tools, techniques, and strategies to trace and isolate issues in the code. Program testing is the process of evaluating a software program to ensure that it behaves as expected and meets its intended requirements. It involves designing and executing tests, analyzing test results, and verifying the correctness and reliability of the program."
what is event logging in software development?,"Event logging is a mechanism in software development that involves capturing and storing information about events or actions that occur during the execution of a program. Events can include errors, warnings, user interactions, system events, and other relevant information. Event logging is commonly used for monitoring, troubleshooting, and analyzing the behavior and performance of software systems. It can provide valuable insights into the runtime behavior of a program and help in identifying and resolving issues."
explain the concept of event logging.,"Event logging is a mechanism in software development that involves capturing and storing information about events or actions that occur during the execution of a program. Events can include errors, warnings, user interactions, system events, and other relevant information. Event logging is commonly used for monitoring, troubleshooting, and analyzing the behavior and performance of software systems. It can provide valuable insights into the runtime behavior of a program and help in identifying and resolving issues."
what is propositional logic?,"Propositional logic, also known as propositional calculus or sentential logic, is a branch of mathematical logic that deals with the study of logical relationships between propositions or statements. Propositions are expressions that are either true or false, and they can be combined using logical connectives such as AND, OR, NOT, and IMPLIES to form compound propositions. Propositional logic is used in formal reasoning, deductive reasoning, and symbolic logic to analyze and evaluate the truth values of logical statements."
explain the concept of propositional logic.,"Propositional logic, also known as propositional calculus or sentential logic, is a branch of mathematical logic that deals with the study of logical relationships between propositions or statements. Propositions are expressions that are either true or false, and they can be combined using logical connectives such as AND, OR, NOT, and IMPLIES to form compound propositions. Propositional logic is used in formal reasoning, deductive reasoning, and symbolic logic to analyze and evaluate the truth values of logical statements."
what are logical connectives in propositional logic?,"Logical connectives are symbols or operators used in propositional logic to combine or modify propositions or statements. Common logical connectives include AND (), OR (), NOT (), IMPLIES (), EQUIVALENT (), and others. These connectives are used to create compound propositions or logical expressions by specifying the relationship between propositions, such as conjunction (AND), disjunction (OR), negation (NOT), implication (IMPLIES), and equivalence (EQUIVALENT). Logical connectives are the building blocks of propositional logic and are used to create complex logical expressions."
explain the concept of logical connectives.,"Logical connectives are symbols or operators used in propositional logic to combine or modify propositions or statements. Common logical connectives include AND (), OR (), NOT (), IMPLIES (), EQUIVALENT (), and others. These connectives are used to create compound propositions or logical expressions by specifying the relationship between propositions, such as conjunction (AND), disjunction (OR), negation (NOT), implication (IMPLIES), and equivalence (EQUIVALENT). Logical connectives are the building blocks of propositional logic and are used to create complex logical expressions."
what are truth tables in propositional logic?,"Truth tables are tables used in propositional logic to represent and analyze the truth values of logical propositions or statements. A truth table lists all possible combinations of truth values for the propositions in a logical expression and shows the resulting truth value of the expression for each combination. Truth tables are used to evaluate the validity, consistency, and satisfiability of logical expressions, and to determine the truth values of complex propositions based on the truth values of their constituent propositions. Truth tables are an important tool in formal logic for reasoning about the truthfulness of logical statements."
explain the concept of truth tables.,"Truth tables are tables used in propositional logic to represent and analyze the truth values of logical propositions or statements. A truth table lists all possible combinations of truth values for the propositions in a logical expression and shows the resulting truth value of the expression for each combination. Truth tables are used to evaluate the validity, consistency, and satisfiability of logical expressions, and to determine the truth values of complex propositions based on the truth values of their constituent propositions. Truth tables are an important tool in formal logic for reasoning about the truthfulness of logical statements."
what is universal quantification in predicate logic?,"Universal quantification is a concept in predicate logic that quantifies over all elements in a domain or set. It is denoted by the symbol  (for all) and is used to express statements that are true for every member of a domain. For example, the statement x P(x) means that the predicate P holds for all elements x in the domain. Universal quantification allows for generalization and abstraction in logic, allowing us to make statements that hold universally for all instances."
explain the concept of universal quantification.,"Universal quantification is a concept in predicate logic that quantifies over all elements in a domain or set. It is denoted by the symbol  (for all) and is used to express statements that are true for every member of a domain. For example, the statement x P(x) means that the predicate P holds for all elements x in the domain. Universal quantification allows for generalization and abstraction in logic, allowing us to make statements that hold universally for all instances."
what is existential quantification in predicate logic?,"Existential quantification is a concept in predicate logic that quantifies over at least one element in a domain or set. It is denoted by the symbol  (there exists) and is used to express statements that are true for at least one member of a domain. For example, the statement x P(x) means that there exists an element x in the domain for which the predicate P holds. Existential quantification allows for the existence of specific instances in logic, allowing us to make statements that assert the existence of certain elements."
explain the concept of existential quantification.,"Existential quantification is a concept in predicate logic that quantifies over at least one element in a domain or set. It is denoted by the symbol  (there exists) and is used to express statements that are true for at least one member of a domain. For example, the statement x P(x) means that there exists an element x in the domain for which the predicate P holds. Existential quantification allows for the existence of specific instances in logic, allowing us to make statements that assert the existence of certain elements."
what is the rate of growth of algorithm complexity?,"Rate of growth of algorithm complexity refers to how the running time or resource usage of an algorithm increases as input size grows. It is commonly represented using Big O notation, which describes the upper bound on worst-case time complexity. Understanding rate of growth is crucial in comparing algorithm efficiency."
explain rate of growth in algorithm analysis.,"Rate of growth of algorithm complexity refers to how the running time or resource usage of an algorithm increases as input size grows. It is commonly represented using Big O notation, which describes the upper bound on worst-case time complexity. Understanding rate of growth is crucial in comparing algorithm efficiency."
what are asymptotic notations?,"Asymptotic notations describe the upper and/or lower bounds on algorithm complexity. Common notations include Big O, Omega, and Theta notation. Big O describes the upper bound on worst-case time complexity, Omega describes the lower bound on best-case time complexity, and Theta describes both upper and lower bounds. They are used to analyze and compare algorithm efficiency."
explain asymptotic notations in algorithm analysis.,"Asymptotic notations describe the upper and/or lower bounds on algorithm complexity. Common notations include Big O, Omega, and Theta notation. Big O describes the upper bound on worst-case time complexity, Omega describes the lower bound on best-case time complexity, and Theta describes both upper and lower bounds. They are used to analyze and compare algorithm efficiency."
what are time-space trade offs in algorithms?,"Time-space trade offs refer to the trade-off between the amount of time (or computational resources) an algorithm takes and the amount of memory (or space) it uses. In some cases, an algorithm may use more memory to reduce its running time, or vice versa. Finding the right balance between time and space usage is an important consideration in algorithm design and optimization."
explain time-space trade offs in computer algorithms.,"Time-space trade offs refer to the trade-off between the amount of time (or computational resources) an algorithm takes and the amount of memory (or space) it uses. In some cases, an algorithm may use more memory to reduce its running time, or vice versa. Finding the right balance between time and space usage is an important consideration in algorithm design and optimization."
what are common operations on strings?,"Operations on strings typically include concatenation (joining), substring extraction, length calculation, searching, and modification (such as replacing characters or converting case). Strings are commonly used for handling text data in programming languages and have built-in functions or methods to perform these operations efficiently."
explain operations on strings in computer programming.,"Operations on strings typically include concatenation (joining), substring extraction, length calculation, searching, and modification (such as replacing characters or converting case). Strings are commonly used for handling text data in programming languages and have built-in functions or methods to perform these operations efficiently."
what is word processing?,"Word processing refers to the creation, editing, and formatting of documents containing text. Word processing software, such as Microsoft Word, Google Docs, or LibreOffice Writer, provides tools and features for creating and editing documents with various formatting options, such as fonts, styles, headers, footers, and more."
explain word processing in computer applications.,"Word processing refers to the creation, editing, and formatting of documents containing text. Word processing software, such as Microsoft Word, Google Docs, or LibreOffice Writer, provides tools and features for creating and editing documents with various formatting options, such as fonts, styles, headers, footers, and more."
